{
  "$schema": "https://json-schema.org/draft/2020-12/schema",
  "$id": "https://roamory.app/contracts/clip_sidecar.schema.json",
  "title": "ClipSidecar",
  "description": "clips/{moment_id}.json, written next to clips/{moment_id}.mp4 when a moment finalizes (TRD 5.3). Phone-internal: Buffer writes it, Edit reads it. Moment fields that can change after finalizing (event_type, description, score) stay in the Moment record, not here.",
  "type": "object",
  "additionalProperties": false,
  "required": [
    "version",
    "moment_id",
    "trip_id",
    "session_id",
    "source",
    "trigger_ms",
    "from_ms",
    "to_ms",
    "clip_path",
    "duration_s",
    "has_audio",
    "fps_profile",
    "samples"
  ],
  "properties": {
    "version": {"type": "integer", "const": 1},
    "moment_id": {"type": "string", "pattern": "^[A-Za-z0-9_-]+$"},
    "trip_id": {"type": "string", "minLength": 1},
    "session_id": {"type": "string", "minLength": 1},
    "source": {"type": "string", "enum": ["ai", "button", "local_fallback"]},
    "trigger_ms": {"type": "integer", "minimum": 0, "description": "Trip clock."},
    "from_ms": {
      "type": "integer",
      "minimum": 0,
      "description": "Trip-clock time of the clip file's first frame (on a 2 s segment boundary, so up to 2 s before the moment's fromMs)."
    },
    "to_ms": {"type": "integer", "minimum": 0},
    "clip_path": {
      "type": "string",
      "description": "Relative to the app's trip folder, e.g. clips/m_07.mp4."
    },
    "duration_s": {"type": "number", "exclusiveMinimum": 0},
    "has_audio": {"type": "boolean"},
    "fps_profile": {
      "type": "array",
      "minItems": 1,
      "description": "Frame-rate changes in the clip, sorted by t_s. The first entry has t_s = 0.",
      "items": {
        "type": "object",
        "additionalProperties": false,
        "required": ["t_s", "fps"],
        "properties": {
          "t_s": {"type": "number", "minimum": 0, "description": "Seconds from the clip file's start."},
          "fps": {"type": "number", "exclusiveMinimum": 0}
        }
      }
    },
    "samples": {
      "type": "array",
      "description": "Stage 1 samples (TRD 6) that fall inside the clip, sorted by t_s. May be empty; the pre-pass then centers on the trigger.",
      "items": {
        "type": "object",
        "additionalProperties": false,
        "required": ["t_s", "sharpness", "change", "dhash"],
        "properties": {
          "t_s": {"type": "number", "minimum": 0, "description": "Seconds from the clip file's start."},
          "sharpness": {"type": "number", "minimum": 0},
          "change": {"type": "number", "minimum": 0},
          "dhash": {
            "type": "string",
            "pattern": "^[0-9a-f]{16}$",
            "description": "64-bit difference hash as 16 lowercase hex digits."
          }
        }
      }
    }
  }
}
